{
  "$schema": "https://json-schema.org/draft/2020-12/schema",
  "$id": "https://meddefense.local/schemas/alert_queue_schema.json",
  "title": "MedDefense Alert Queue",
  "description": "Locked input contract for the 3x03 Tier 1 triage queue.",
  "type": "array",
  "items": {
    "type": "object",
    "additionalProperties": false,
    "required": [
      "alert_id",
      "generated_at",
      "rule_id",
      "rule_title",
      "rule_level",
      "priority_score",
      "event_ref",
      "event_summary",
      "asset_context",
      "attack_techniques",
      "status",
      "evidence_hash"
    ],
    "properties": {
      "alert_id": {
        "type": "string",
        "format": "uuid"
      },
      "generated_at": {
        "type": "string",
        "format": "date-time"
      },
      "rule_id": {
        "type": "string",
        "format": "uuid"
      },
      "rule_title": {
        "type": "string"
      },
      "rule_level": {
        "enum": [
          "informational",
          "low",
          "medium",
          "high",
          "critical"
        ]
      },
      "priority_score": {
        "type": "number",
        "minimum": 0
      },
      "event_ref": {
        "type": "string",
        "minLength": 1
      },
      "event_summary": {
        "type": "object",
        "additionalProperties": false,
        "required": [
          "timestamp",
          "hostname",
          "user",
          "src_ip",
          "dst_ip",
          "process_name",
          "canonical_label",
          "event_category"
        ],
        "properties": {
          "timestamp": {
            "type": [
              "string",
              "null"
            ]
          },
          "hostname": {
            "type": [
              "string",
              "null"
            ]
          },
          "user": {
            "type": [
              "string",
              "null"
            ]
          },
          "src_ip": {
            "type": [
              "string",
              "null"
            ]
          },
          "dst_ip": {
            "type": [
              "string",
              "null"
            ]
          },
          "process_name": {
            "type": [
              "string",
              "null"
            ]
          },
          "canonical_label": {
            "type": [
              "string",
              "null"
            ]
          },
          "event_category": {
            "type": [
              "string",
              "null"
            ]
          }
        }
      },
      "asset_context": {
        "type": [
          "object",
          "null"
        ]
      },
      "attack_techniques": {
        "type": "array",
        "items": {
          "type": "string",
          "pattern": "^T[0-9]{4}(\\.[0-9]{3})?$"
        },
        "uniqueItems": true
      },
      "status": {
        "const": "new"
      },
      "evidence_hash": {
        "type": "string",
        "pattern": "^[a-f0-9]{64}$"
      }
    }
  }
}
